{
  "assessment_id": "assess-001",
  "principles_checked": [
    "dignidade_humana",
    "nao_maleficencia",
    "transparencia"
  ],
  "tensions": [
    "risco_operacional_moderado"
  ],
  "alignment_score": 0.82,
  "risk_buckets": {
    "ethical": "low",
    "operational": "medium"
  },
  "recommendations": [
    "Manter supervisão humana na decisão final."
  ],
  "decision": "approve_with_constraints",
  "version": "1.0.0"
}
